id,summary
test_92,"#Person2#는 무표정한 사람들을 좋아하지 않지만, 그들과 어울리지 못해 불편함을 느낀다. 또한, 무표정한 사람들을 싫어하는 이유를 설명한다. #Ferson1#은 이에 동의하지 않는다. 두 사람 모두 그들의 무표정을 싫어한다. 결국 둘은 대화를 마무리한다. 대화는 마무리된다. 그들은 서로의 근황에 대해 이야기한다. 그들은 서로의 입장을 이해하지 못한다. 결국 웃는다. 대화는 끝난다. 그들은 피곤함을 느낀다고 느낀다. 이에 대해"
test_93,"#Person2#는 작년 판매 실적이 좋았다고 말하며, Wallace의 전략과 새로운 광고 캠페인을 통해 연간 판매 기록을 갱신했다고 언급한다. 그들은 또한 회사의 성과에 대해 논의한다. #Perceivilization는 재정적 어려움이 영원히 끝나기를 희망한다. 그들은 행운이 오래 가기를 바란다. 그들은 오래 지속되기를 바란다고 말한다. 그들은 또한 오래 지속하기를 바란다고 덧붙인다. 모든 일이 잘 풀리길 바란다. 그러길 바라고 있다."
test_94,#Person2#는 가방을 도난당해 지갑과 신분증을 도난당한 상황이다. 그는 택시비 50달러를 빌리고 집에 가서 엄마에게 돈 부탁을 할 예정이다. 이를 도와주겠다고 제안하자 어머니는 기쁘게 응원한다. #Ferson1#은 기쁘게 동의한다. #Free는 금요일에 돈을 갚고 집에 데려다 줄 예정이다. #Family는 엄마를 위해 돈을 빌리겠다고 한다. #Fallil
test_95,"Steven과 Lin은 식사 후 중국에서의 팁 관습에 대해 이야기한다. 중국에서는 팁이 일반적이지 않으며, 택시 기사나 포터는 미터기에 표시된 금액만 지불한다. 이 시스템을 도입하려고 하면 혁명이 일어날 것이다. 그들은 이 시스템을 받아들여야 한다고 생각한다. Lin이 이에 동의한다. 그들은 이 시스템에 도입할 것이다. 이 시스템을 여기 도입하려고 할 것이다. 그들은 혁명을 일으킬 것이다. 그들은 그렇게 하겠다고 결심한다. 그들은 이를 실행할 것이다. 그들은"
test_96,빌은 룸메이트와 헤어졌고 Brain Locker라는 이름으로 이사했다. #Person1#은 그 사람을 몇 번 본 것 같다고 생각한다. 빌은 그 사람이 키가 크고 안경을 쓴 사람이라고 추측한다. 그는 이전에 여러 번 본 적이 있다고 말한다. 그는 이전에 그 사람을 본 적이 있다. 그는 이전에 이사를 했었다. 그는 자신의 외모에 대해 설명한다. 그는 또한 이사를 했다고 덧붙인다. Brangker는 키가 크다.
test_97,#Person2#는 Tom Wilson이 호텔에서 4박 동안 각각 90달러와 660달러를 신용카드로 결제할 수 있도록 도와줍니다. 요금은 신용카드에 결제될 예정입니다. 비용은 960달러입니다. 요금은 현금으로 결제됩니다. 비용은 신용카드에 서명해야 합니다. 비용은 결제를 완료합니다. 비용은 카드에 따라 지불됩니다. 결제 완료 후 서명합니다. 완료 완료. 완료...
test_98,캐롤이 샤워 중이어서 #Person1#이 수잔에게 전화를 걸어 캐롤의 파티 날짜와 디저트를 요청합니다. 수잔은 이를 도와줄 것입니다. 캐롤은 내일 밤 8시 반에 캐롤에게 디저트 가져오라고 요청했습니다. 또한 #Pson2#는 수잔이 참석할 예정입니다. 수잔의 파티가 목요일임을 알렸습니다. 그들은 내일 밤 8시에 열리기를 기대합니다. 그들은 내일 저녁에 만나기로
test_99,#Person2#는 이전에 시내 영화관에서 일한 적이 있습니다. #Perceiva는 이전에 그곳에서 일했던 다른 사람들과의 대화에서 잊어버리고 말합니다. 결국 그 사람은 그 곳에 가기로 결정합니다. 하지만 그 사람은 다시 그곳에 가기를 원합니다. 그는 다시 가기로 합니다. #Aerson1#은 그 장소를 기억하지 못합니다. 그는 떠나기 위해 서둘러 떠납니다. 결국 그 자리에 도착합니다. 그 후 두 사람은 다시 만나기로 합니다. 그는 자리를 떠난다. #
test_100,#Person1#은 트럼프를 지지하며 그가 재선될 경우 기뻐하고 존경심을 표현합니다. 또한 그들은 그가 나라를 잘 돌볼 것이라고 믿습니다. 결국 #Fishn은 바이든을 찍을 것이라고 예상합니다. 그러나 그 의견에 동의하지 않습니다. 그는 그가 대통령이 될 것이라고 확신하지 않기 때문입니다. 그들은 또한 바이든에 대해서도 이야기합니다. 결국 그들은 동의합니다. 그들은 함께 선출됩니다. 그들은 다음 대통령 선거에 대해 논의합니다. 그들은 모두 승리할 것입니다. 그들은 또한 다음 대통령
test_101,"#Person1#은 ATM을 사용하기 위해 복잡한 절차를 설명하며, 기계에 카드를 넣고, 비밀번호를 입력하는 방법을 안내합니다. 또한 원하는 옵션을 선택하도록 도와줍니다. 이를 통해 비밀번호 입력을 완료합니다. 이를 완료합니다. 또한 #person2#는 도와줍니다!"
test_102,수잔 밀러는 John에게 사무실 절차에 관한 메모를 전달하기 위해 그의 비서에게 한 부 요청한다. JOhn은 그 요청을 수잔에게 전달한다. 수잔은 고마워한다. 그들은 메모에 대해 다시 논의한다. 이후 그들은 메모의 내용을 확인한다. 이후 메모는 다시 교환된다. 대화는 마무리된다.
test_103,"#Person1#이 Lily를 주말에 소풍에 초대하고 편한 옷과 걷기 좋은 신발을 준비하겠다고 합니다. Lil리는 동의합니다. 그들은 편한 옷을 챙기고, 신발을 모두 준비할 것입니다. 그들은 내일 소풍을 갈 예정입니다. Lili는 신발을 챙기겠다고 말합니다. 그들은 준비됩니다. 그들은 내일 함께 소풍을 가기로 합니다. 그들은 함께 갈 것입니다. 그들은 신발을 가져갈 것입니다. 그들은 함께 준비하기로 합니다. 그들은 내일 출발할 예정"
test_104,"#Person1#은 중국 연회에 초대되어 젓가락을 사용해야 한다고 제안하지만, 중국인들은 중국 식탁에서 어색하거나 무례해 보일 수 있어 혼란스러워합니다. 젓가락에도 긴 이야기가 있다는 사실에 놀란다고 말합니다. 결국 #Ferson2#는 그 긴 이야기를 받아들입니다. #Freedom은 숟가락을 밥그릇에 꽂지 말아야 했고, 이는 죽은 사람에게 바치는 향 두 개를 닮았다고 설명합니다. 숟가락도 마찬가지라고 합니다."
test_105,Mary와 Frank는 서로 좋아하는 영화 장르에 대해 이야기한다. 그들은 영화관에 자주 가지 않으며 주로 Movie Salon에서 영화를 빌린다. 그들은 영화 대여점에 가입하기 위해 회원 가입을 할 예정이다. 그들은 영화에 대한 관심을 공유한다. Francsa는 동네에 있는 영화 대여점에서 영화를 빌리고 싶어 한다. Marty도 이에 동의한다. 그들은 함께 가입할 예정이다. Frang은 동의한다. 그는 영화관에 가기로
test_106,"#Person2#는 녹색당에 가입할 의향이 있으며, 환경 문제에 관심이 많습니다. 그는 작은 정치 단체나 압력 단체도 큰 정당에 영향을 미칠 수 있다고 말합니다. 미디어가 정치 사건을 자주 보도한다고 언급합니다. 또한 정치에 대해 잘 알지 못합니다. 미디어는 정치 사건을 보도합니다. 정치에 대한 사람들의 인식도 개선할 수 있습니다. 이는 미디어의 영향이라고 합니다. 이는 많은 사람들이 정치에 무관심합니다. 대부분의 사람들이 문제를 이해하지 못합니다. 반면에 많은 사람들이 문제를 완전히 이해"
test_107,"#Person1#은 Wilson 씨에게 상품 문제로 발생한 실수에 대해 사과하며, 두 번째 문제는 조사가 끝난 후 해결할 것이라고 약속합니다. 또한 Willson 씨는 수출품 포장을 개선할 계획을 세웠다고 설명합니다. 또한 두 번째 문제에 대해서는 기준에 미치지 못하는 상품을 교환해 주겠다고 약속합니다. 이를 계기로 일이 해결되기를 바랍니다. 또한 수출품의 포장 개선 계획도 제시합니다. Wilhon 씨는 이를 승인합니다. 이에 따라 회사는 이를 실행합니다. #P"
test_108,#Person2#는 강도 사건을 목격하고 경찰서에 방문할 것을 요청합니다. 총을 들고 들어오는 사람을 보고 경찰서에 오기를 요청합니다. #Ferson1#은 그를 경찰서에 데려다 줄 예정입니다. 그는 경찰서에 곧 도착할 것입니다. #Alliancy는 경찰에게 질문할 것입니다. 경찰이 도착할 때까지 기다릴 것입니다. 경찰이 경찰서를 안내할 것입니다. 그들은 함께 경찰서를 지날 것입니다. 그들은 서로에게 질문을 할 것입니다. #Blue는 이에
test_109,"#Person1#이 저녁을 먹고 싶다고 하자, 아빠가 피자를 주문하러 간다고 말합니다. 이후 #person2#는 피자가 일주일에 한 번 나온다고 설명합니다. #Francs는 피자 주문을 제안하고 피자를 함께 주문하기로 합니다. 그들은 피자 메뉴를 맞추기로 합니다. #Freen은 이에 동의합니다. 그들은 서로의 의견을 교환합니다. 그들은 피자를 어디서 주문할지 논의합니다. 결국 피자가 완성됩니다. #P"
test_110,#Person1#은 새해 결심에 따라 다이어트를 시작하고 정크푸드를 끊기로 했습니다. 이는 이전의 잘못된 식습관을 개선하기 위한 조치입니다. #Ferson2#는 이를 믿고 기다리기로 합니다. 그들은 음식을 먹기 시작했습니다. 과자가 남아 있는지 확인합니다. 결국 과자가 남았습니다. 그들은 함께 먹었습니다. 과자는 남은 상태였습니다. 남은 과자를 먹기 위해 남은 시간이 남아 있었습니다. 그러나 남은 과자는 남아 있지 않았습니다. 남아 있습니다. 남은
test_111,"Karen Huang은 Comp Lit 287 수업에 등록하려 했으나, 컴퓨터가 승인하지 않아 불가능합니다. #Person1#은 그에게 비교문학 전공에 대해 설명하며 코드 번호와 사용법을 안내합니다. 또한 등록 시스템에 다시 전화하여 등록할 수 있도록 도와줍니다. 이후 안내를 받고 등록을 완료합니다. Koren은 터치톤 등록 시스템을 통해 등록해야 하지만 컴퓨터가 만원이란 사실을 알게 됩니다. Khang은 수업"
test_112,"#Person1#은 우산을 쓰고 가든 호텔로 가려고 하고, #Fordina는 우산을 함께 쓴다. 그들은 함께 걸어서 길을 가기로 한다. 그들은 함께 가고 싶어 한다. 결국 둘은 함께 걸기로 한다. 그 길로 함께 간다. 그들은 합류한다. 둘 다 만족한다. 결국 함께 걸어가기로 한다. 그는 동의한다. 이에 동의한다. 그들은 함께 산다. 그 길로 간다. 그다. 그 후 그들은 함께 걷는다. 그 길에 함께 걸었다. 그들은 함께 가기로"
test_113,"Jack은 #Person1#에게 자신이 가진 것 중 가장 빠른 차를 태워주겠다고 제안합니다. 그들은 흥분하며 차를 찾으러 갑니다. 결국, 그들은 좋은 차를 선택합니다. 그들은 좋은 차에 만족하게 됩니다. 그들은 만족스러운 차를 타기로 결정합니다. Daisy는 그를 격려합니다. 그는 이를 수락합니다. 그는 만족스러워합니다. 그들은 결국 차를 탑니다. 그들은 다시 만나기로 합니다. 그들은 행복합니다. 그들은 다음 순서를 기다립니다. 그들은 다음을 향합니다. 그들은"
test_114,"#Person2#는 큰불이 난 시간과 일치하지 않습니다. #PAerson1#은 정확한 시간과 장소를 기억하지 못하지만, 그날 밤 10시에 큰불이 났다고 말합니다. #Perceiva는 정확한 시간을 알고 싶어합니다. 결국 그들은 정확한 시간을 잡기 위해 노력할 것입니다. 결국 그들은 동의합니다. 그들은 정확한 시간이 필요하다고 합니다. 그들은 내일 아침에 다시 만나기로 합니다. 그들은 오후에 다시 만날 예정입니다."
test_115,#Person2#는 남편이 신용카드로 계산하려 하자 계산대에서 900위안을 현금으로 지불합니다. 영수증을 보여줍니다. #person1#은 카드를 다시 포장해 줍니다. 남편은 다시 방문하기를 원합니다. #Presidents.org.button.s.ac.kr.
test_116,"#Person2#는 자신의 차를 일반 세차 패키지로 세차하고 싶어 합니다. #Pson1#은 이를 도와주고 진공청소기로 먼지와 쓰레기를 제거한다고 설명합니다. #Force는 이에 만족합니다. 결국, 그들은 일반 세차를 하기로 결정합니다. 그 후에 일반 세차의 패키지를 선택하기로 합니다. 그 후 구매를 완료합니다. 그 후 일반 세차로 변경합니다. 그 내용입니다. 그 후 자세한 내용을 알게 됩니다. 그 후 동의합니다. #P"
test_117,"#Person1#은 해리에게 어디로 휴가를 갈지 묻고, 해리는 배로 가거나 비행기로 갈 것이라고 답한다. #Prony는 아내의 걱정을 덜어줘야 여행이 가능하다고 생각한다. 해리는 아마 어디도 갈 수 있다고 확신한다. 해리는 아내와 함께 여행을 갈 수도 있다고 말한다. 해리의 아내는 항상 걱정을 안고 있다. 해리는 강아지를 돌볼지, 집은 누가 관리할지, 정원은 누가 돌볼지 걱정해야 여행을 갈 수"
test_118,"#Person1#은 새로운 회원으로서 Johnson에게 기계 사용법을 물어봅니다. Jehbecca는 스트레칭을 잘하고 운동 카드를 준비하여 기계의 진도를 추적할 수 있으며, 각 기계에 적합한 시작 무게를 설정할 수 있다고 설명합니다. 또한, 모든 기계의 시작 무게를 카드에 기록하고, 회원번호를 적고 회원번호를 인쇄하여 운동 속도를 조절할 수 있도록 안내합니다. #person2#는 모든 기계가 지쳤"
test_119,"#Person1#은 회사가 문을 닫았기 때문에 실직 상태이며, 두 사람 모두 먹고 살 정도의 일만 있으면 좋겠다고 말한다. 그들은 전기 기술자 프로그램에 지원하기로 결정한다. 그들은 가서 어떻게 지원할지 알아보기로 한다. 그들은 최종적으로 전기 기술자를 뽑기로 결정한다."
test_120,"#Person1#은 강아지에게 밥을 주고, 목욕시키며 토요일 오전 11시에 수의사 예약을 할 수 있도록 도와준다. 이를 잊지 않고 기억하도록 할 것이다. 잊지 않도록 할 것이다. 이를 기억할 것이다. 또한 잊지 않도록 하겠다고 약속한다. 그 약속을 잊지 않도록 상기시킨다. 그 약속을 기억하도록 한다. 잊지 잊지 않을 것이다."
test_121,#Person1#은 집주인 아주머니께 200달러 빚이 있어 에이든에게 돈을 빌려달라고 요청합니다. 에이든은 월요일에 월급이 들어오는 대로 돈을 빌려주겠다고 동의합니다. #Francs는 저녁에 초대하여 저녁 식사에 초대한다. 그들은 함께 저녁을 먹기로 한다. 저녁에 시간이 되면 다시 만나기로 한다. 그때 저녁에 함께 나가서 저녁을 먹을 예정이다. 그때쯤에 에이든이 나타나서 함께 저녁에 가기로 한다.
test_122,#Person2#는 두 달 동안 자선 단체에서 일하며 많은 것을 배웠다고 말합니다. 이러한 경험이 그의 사고방식에 영향을 미쳤다고 생각합니다. 또한 사회 활동이 자신과 사물을 신경질적으로 대하는 방식을 개선시켰다고 합니다. 그는 또한 사회 활동을 긍정적으로 평가합니다. #person1#은 이에 대해 동의합니다. 그들은 이룩한 성과에 대해 이야기합니다. 이후 #Perceivilizations의 발전과 그로 인해 얻은 성과에 대해서도 이야기
test_123,#Person2#는 약 일주일 후 #Perceiva와 연락하기 위해 전화나 이메일로 연락합니다. 결과는 약 일주일 후에 나올 예정입니다. 감사드립니다. #Prisiva는 감사의 뜻을 표합니다. #Ferson1#은 곧 연락하겠다고 약속합니다. 약 일주일 뒤 #Preva는 답합니다. 결과는 일주일 후에 알려주겠다고 합니다. 그때 뵙겠습니다. 감사합니다. 그럼 안녕히 계십니다.
test_124,#Person2#는 호텔에서 가장 잘 나가는 요리인 모우탄과 전형적인 중국 요리를 추천합니다. 베이징 오리 구이는 호텔에서 가장 유명한 요리로 평가받습니다. 두 사람은 모우탄을 시도해 보기로 결정합니다. 그들은 베이징 요리를 먹어보고 싶어 합니다. #Ferson1#은 그 요리를 시도하기로 합니다. 둘은 함께 맛을 보기로 합니다. 그들은 다음 날 다시 방문할 예정입니다. 이를 기대하고 있습니다. 이를 기다리기로 합니다. #필립이 도착합니다. #P
test_125,Angela와 Dan은 다음 주에 결혼하는 결혼식에 참석하기 위해 공항에서 기다리고 있다. 그들은 Megan을 초대하기로 결정한다. Dan이 먼저 참석할 예정이다. 그들은 먼저 그들을 데리러 가기로 한다. #Person1#이 먼저 가겠다고 한다. 그들은 함께 차를 탄다. 그들은 함께 가기로 계획한다. 그들은 먼저 가기로 결정한다. 그들은 함께 갈 예정이다. Dan을 보낸다. 그들은 먼저 갈 것이다. 그들은 먼저 가고 싶어 한다. 그들은
test_126,"#Person2#는 그리스에서 인기 있는 매일 먹는 매일 먹는 디저트인 티라미수와 튀긴 바나나를 먹어보고 싶어 한다. 그들은 이탈리아에서 온 현지 특산물인 바나나 두 개도 함께 먹기로 결정한다. 그들은 바나나가 달고 바삭하다는 데 동의한다. 이후, 그들은 각자 다른 지역에서 온 음식임을 깨닫는다. 바나나의 맛에 대해 이야기한다. 그러고 나서, 그들은 바비큐를 먹기로 한다. 바나나는 남쪽 지역의"
test_127,"#Person1#은 Smith 씨에게 대학, 학위, 경력, 급여, 급여에 대해 질문하고, 그의 최근 경력에 대해 답변합니다. 이후, 그는 지난 5년간 은행에서 일했다고 말합니다. 급여는 주당 500달러였다고 합니다. 급여는 500달러였습니다. 급여는 은행에서 지불한 것으로 알려졌습니다. 경력은 은행에서 4년간 일했습니다. 은행에서 500달러를 받았습니다. 은행에서 급여는 매우 높았습니다. 연봉은 911114달러였"
test_128,"#Person1#은 조카를 위해 베스트셀러인 바비 인형을 $29.95에 구매하고, 현금으로 결제합니다. 바비는 베스트셀러로 현재 $32.42에 구매 완료되었습니다. 고객은 현금으로 구매를 완료했습니다. 가격은 $28.42입니다. 고객은 결제 금액에 대해 신용카드로 결제합니다. 고객은 현금을 사용합니다. 현금 사용으로 결제 완료했습니다. 고객은 결제를 완료했습니다. 그들은 구매 금액을 현금으로 지불했습니다. 쇼핑을 완료했습니다. #P"
test_129,"#Person2#는 41 사이즈 조던 운동화 한 켤레를 구매하고 싶어 하지만, 이미 세일 중이라 더 저렴한 가격만 요청합니다. 결국, 그 사이즈가 맞는 가격만 제시합니다. 결국 그들은 합의합니다. 그들은 더 저렴한 운동화를 구매하기로 합니다. 그들은 더 저렴하게 구매할 수 있게 됩니다. 그들은 또한 다른 운동화 구매를 결정합니다. 그들은 추가 할인에 대해서도 논의합니다. 결국 합의합니다. 결과는 내일 오후에 나올 예정입니다."
test_130,#Person1#은 과학박물관에 가기 위해 기차를 타려 했으나 기차를 놓치게 되었습니다. 이에 따라 두 사람은 기차를 타고 State Street 역으로 가기로 했습니다. 기차는 세 정거장을 지나고 State 스타reet에서 내리기를 반복했습니다. 마지막에 그들은 목적지까지 갑니다. 기차는 다음 정거장에서 내리기를 원합니다. 두 사람은 잘 다녀오셨습니다. 감사했습니다. 그들은 잘 다녀왔습니다. 그들은 잘 돌아갑니다. 그들은 잘
test_131,"사이먼은 #Person1#에게 '단계적 은퇴'라고 불리는 제도에 참여하며 6개월 동안 일을 쉬고 이전의 회사에서 프로젝트 업무에 지원할 수 있게 되었다고 설명합니다. 또한 이 제도는 실험적으로 운영되며, 다양한 업무가 게시될 것이라고 말합니다. 회사도 유연성을 얻을 수 있다고 합니다. 사이먼 씨는 자신의 시간을 관리하고 자신의 시간을 회사가 관리할 수 있는 것이 자신의 회사에서 보내는 것보다 낫다고 생각합니다. 회사는 더 나은 선택이라고 합니다. 회사는 더 많은 유연성을 제공"
test_132,"#Person1#은 Rocky가 밤새 앉아 있는 것을 보고 춤을 추자고 제안하지만, Ricky는 자신이 외향적이고 다정하며 사람 차별하지 않는 여자를 좋아한다고 답한다. 그러나, 결국, 그들은 Rusty에게로 돌아가기로 결정한다. RocKy는 TV 저녁 식사와 개 Russier에게 돌아가야 한다고 생각한다. 결국, 결국 그들은 헤어지게 된다. 그들은 서로의 생각을 바꾸어 가기로 결정하지만, Ru"
test_133,"#Person2#는 폭풍으로 창문 몇 개가 깨지고 큰 나무 가지가 부러졌지만, #Ferson1#은 따뜻한 봄날씨가 필요하다고 생각합니다. 하지만 #Francs는 여전히 날씨가 끔찍하다고 생각합니다. 그들은 3월에는 날씨가 좋았다고 말합니다. 그들은 여전히 이 추운 날씨를 불평하지 않습니다. 결국 그들은 봄날씨를 맞이하게 됩니다. 그들은 다시 대화를 나눕니다. 그들은 서로의 생각을 다룹니다. 결국 그들은 헤어집니다. #P"
test_134,"#Person2#는 TV를 자주 보는 것이 지루하다고 느끼며, 나가서 노는 것을 선호하지 않는다. 결국 #Ferson1#은 음악에 함께 가자고 제안한다. #Mr. Silk은 이에 동의한다. 그들은 함께 음악 활동을 하기로 한다. 음악이 더 좋을 것 같다. 결국, 그들은 음악에 가기로 결정한다. #France는 동의한다. 결국 그들은 음악 공연을 하기로 결정한다. 그들은 이를 받아들인다. 이후, 그들은 함께 하기로"
test_135,"#Person1#은 Ben에게 내일 수업에 대해 묻고, Ben은 긴장하며 수업 시작 시간, 숙제 내는 시간, 아침 자습 시간, 쉬는 시간 등을 설명한다. 이후, 두 번째 수업 후 쉬는 시간에 먹을 것을 살 수 있다고 말한다. Ben이 걱정하지 않아도 될 것이라고 안심시킨다. 그 후, 두 사람은 새로운 학교 생활에 적응하기 위해 열심히 공부할 예정이다. 그들은 먹을 것을 찾기로 한다. Ben의 제안에 동의한다. #P"
test_136,Adam은 무릎이 나아졌지만 #Person1#은 달리기를 하지 말라고 권한다. 그들은 미시간의 최근 세 경기 영상을 보고 경기를 예측할 예정이다. 그들은 내일 다시 미시간에서 전면 연습을 하기로 결정한다. 그들은 3일 안에 회복되기를 바라고 있다. 그들은 다시 미시간에 가서 전면 연습하기로 합의한다. 그들은 다시 다시 연습하기로 한다. 미시간으로 돌아가 다시 돌아와 전면 연습할 것이다. 그들은 경기를 볼 예정이다. 미시간은 강한 팀이다. 그들은 먼저 회복되
test_137,"#Person1#이 자신의 프린터가 고장 난 것에 대한 도움을 요청하고, 그 결과 프린트를 받는다. 그 후 두 사람은 프린트가 마음에 든다는 대화를 나눈다. 이후 #person2#는 프린트를 부탁한다. 결국 프린트는 완료된다. 이후 두 사람은 서로의 의견을 교환한다. 이후 그들은 서로의 역할을 다정한다. 결국 프린트가 완성된다. 대화는 마무리된다. 그것으로 끝난다. 이후.."
test_138,#Person1#은 커튼을 달기 위해 사다리를 잡고 싶어 한다. #Ferson2#는 이를 도와주겠다고 한다. 이후 사다리가 잡히면 자신이 올라갈 예정이다. 이를 확인한다. 이후 #Korea가 올라간다. Korea는 이를 수락한다. Kim은 이를 승리한다. Kim의 다음에는 자기가 올라갈 계획이다. Kim이 올라갈 것이다. Kil은 이에 동의한다. Kil의 승리를 축하
test_139,"#Person1#은 Jack에게 주말 캠핑 계획에 대해 달력을 확인해줄 것을 요청하고, 예약이 꽉 차 있음을 확인한다. JacK은 주말이 괜찮다고 보인다고 말한다. 이후, 그들은 다다음 주말 캠핑에 대해 이야기한다. #필요성에 대해 논의한다. 이후, 둘 다 만족스러운 주말을 보낸다. 대화는 마무리된다. 그들은 다음 주말에 캠핑을 가기로 결정한다. 그 후로 그들은 일정을 조율할 예정이다."
test_140,"#Person1#은 임신한 상태이며 출산 예정일이 2009년 10월 27일임을 알고 기뻐한다. 하지만 아기가 훈련 세미나로 인해 나타나지 않아, 그 사실에 놀라워한다. 이후, 임신 사실을 알게 되어, 그 사실을 알게 되고 기뻐한다. 그러나 아기가 자신의 것이 아니라는 사실에 화가 난다. 결국, 그녀는 진실을 깨닫는다. 그 후, 그들은 임신 사실을 확인한다. 그 후, 아기가 출산한 날짜에 대해 이야기한다. 그 후 그들은 진실을 알게 된다. 그들은 결혼 생활을 이어가기로 한다."
